{
  "cost": {
    "agents": 0,
    "completion_tokens": 0,
    "prompt_tokens": 0,
    "usd": 0.0,
    "wall_s": 0.0
  },
  "deterministic": true,
  "inputs_sha": {
    "new_canon": "a859784b29d58d0d92c327e57cd96398e973ffc5447c117cc0a5295f5cac5317",
    "old_canon": "689c890d232194dfbdf93186ce18b1d577db5126bc559c43acb5d781cc8afd93"
  },
  "payload": {
    "id_map": [
      {
        "new": "property_manager/F/repair-ticket-open-and-confirm",
        "old": "property_manager/A/repair-ticket-photo-flow",
        "op": "move"
      },
      {
        "new": "property_manager/F/repair-ticket-photo-recognition-uncertain",
        "old": "property_manager/A/repair-ticket-low-confidence-candidates",
        "op": "merge"
      },
      {
        "new": "property_manager/F/repair-ticket-photo-recognition-uncertain",
        "old": "property_manager/A/repair-ticket-unrecognizable-photo",
        "op": "merge"
      },
      {
        "new": "property_manager/F/repair-ticket-reclassify",
        "old": "property_manager/A/repair-ticket-reclassify",
        "op": "move"
      },
      {
        "new": "property_manager/F/repair-ticket-photo-count-limit",
        "old": "property_manager/A/repair-ticket-photo-count-limit",
        "op": "move"
      },
      {
        "new": "property_manager/F/repair-ticket-urgency-judgment",
        "old": "property_manager/A/repair-ticket-urgency-judgment",
        "op": "move"
      },
      {
        "new": "property_manager/F/repair-ticket-no-lease",
        "old": "property_manager/A/repair-ticket-agent-identity-lease-lookup",
        "op": "merge"
      },
      {
        "new": "property_manager/F/repair-ticket-no-lease",
        "old": "property_manager/A/repair-ticket-vacant-no-lease",
        "op": "merge"
      },
      {
        "new": "property_manager/F/repair-ticket-mid-flow-cancel",
        "old": "property_manager/A/repair-ticket-mid-flow-cancel",
        "op": "move"
      },
      {
        "new": "property_manager/F/repair-ticket-submit-failure",
        "old": "property_manager/A/repair-ticket-submit-failure",
        "op": "move"
      },
      {
        "new": "property_manager/F/repair-ticket-after-submit",
        "old": "property_manager/A/repair-ticket-after-submit",
        "op": "move"
      },
      {
        "new": "property_manager/F/repair-progress-followup-scope",
        "old": "property_manager/C/urgent-repair-followup-scope",
        "op": "move"
      },
      {
        "new": "property_manager/E/dunning-draft-template-tone-late-fee",
        "old": "property_manager/B/dunning-draft-generation",
        "op": "merge"
      },
      {
        "new": "property_manager/E/dunning-draft-template-tone-late-fee",
        "old": "property_manager/B/dunning-draft-late-fee-mention",
        "op": "merge"
      },
      {
        "new": "property_manager/E/dunning-draft-not-auto-send",
        "old": "property_manager/B/dunning-draft-not-auto-send",
        "op": "move"
      },
      {
        "new": "property_manager/E/overdue-bill-followup-scope",
        "old": "property_manager/C/overdue-bill-followup-scope",
        "op": "move"
      },
      {
        "new": "property_manager/D/lease-expiry-followup-scope",
        "old": "property_manager/C/lease-expiry-followup-scope",
        "op": "move"
      },
      {
        "new": "property_manager/G/meter-item-followup-scope",
        "old": "property_manager/C/meter-item-followup-scope",
        "op": "move"
      }
    ],
    "replacements": [
      {
        "fine_id": "",
        "how": "content",
        "old_kb_id": ""
      },
      {
        "fine_id": "",
        "how": "merged_into",
        "old_kb_id": ""
      },
      {
        "fine_id": "",
        "how": "merged_into",
        "old_kb_id": ""
      },
      {
        "fine_id": "",
        "how": "content",
        "old_kb_id": ""
      },
      {
        "fine_id": "",
        "how": "content",
        "old_kb_id": ""
      },
      {
        "fine_id": "",
        "how": "content",
        "old_kb_id": ""
      },
      {
        "fine_id": "",
        "how": "merged_into",
        "old_kb_id": ""
      },
      {
        "fine_id": "",
        "how": "merged_into",
        "old_kb_id": ""
      },
      {
        "fine_id": "",
        "how": "content",
        "old_kb_id": ""
      },
      {
        "fine_id": "",
        "how": "content",
        "old_kb_id": ""
      },
      {
        "fine_id": "",
        "how": "content",
        "old_kb_id": ""
      },
      {
        "fine_id": "",
        "how": "content",
        "old_kb_id": ""
      },
      {
        "fine_id": "",
        "how": "merged_into",
        "old_kb_id": ""
      },
      {
        "fine_id": "",
        "how": "merged_into",
        "old_kb_id": ""
      },
      {
        "fine_id": "",
        "how": "content",
        "old_kb_id": ""
      },
      {
        "fine_id": "",
        "how": "content",
        "old_kb_id": ""
      },
      {
        "fine_id": "",
        "how": "content",
        "old_kb_id": ""
      },
      {
        "fine_id": "",
        "how": "content",
        "old_kb_id": ""
      }
    ],
    "structure_diff": {
      "headings_added": [
        {
          "id": "H",
          "level": "h2",
          "title": "H 幫助中心"
        },
        {
          "id": "I",
          "level": "h2",
          "title": "I 方案與導入"
        },
        {
          "id": "property_manager/D/lease-expiry-followup-scope",
          "level": "h3",
          "title": "合約到期追問可答範圍（導向續約面向）"
        },
        {
          "id": "property_manager/E/dunning-draft-not-auto-send",
          "level": "h3",
          "title": "催繳草稿不可一鍵發送給租客"
        },
        {
          "id": "property_manager/E/dunning-draft-template-tone-late-fee",
          "level": "h3",
          "title": "催繳草稿的生成規則（模板、語氣分級與滯納金提及）"
        },
        {
          "id": "property_manager/E/overdue-bill-followup-scope",
          "level": "h3",
          "title": "逾期帳單追問可答範圍"
        },
        {
          "id": "property_manager/F/repair-progress-followup-scope",
          "level": "h3",
          "title": "修繕進度追問可答範圍"
        },
        {
          "id": "property_manager/F/repair-ticket-after-submit",
          "level": "h3",
          "title": "確認送出後的單如何處理"
        },
        {
          "id": "property_manager/F/repair-ticket-mid-flow-cancel",
          "level": "h3",
          "title": "報修流程中途取消的規則"
        },
        {
          "id": "property_manager/F/repair-ticket-no-lease",
          "level": "h3",
          "title": "代開單時的租約查詢身分與空屋／無租約物件開單規則"
        },
        {
          "id": "property_manager/F/repair-ticket-open-and-confirm",
          "level": "h3",
          "title": "開修繕單基本流程與確認機制（拍照進場／文字口述）"
        },
        {
          "id": "property_manager/F/repair-ticket-photo-count-limit",
          "level": "h3",
          "title": "修繕辨識與附件的照片張數限制"
        },
        {
          "id": "property_manager/F/repair-ticket-photo-recognition-uncertain",
          "level": "h3",
          "title": "照片辨識信心不足或看不出損壞時的處理"
        },
        {
          "id": "property_manager/F/repair-ticket-reclassify",
          "level": "h3",
          "title": "確認卡上修改辨識結果的規則"
        },
        {
          "id": "property_manager/F/repair-ticket-submit-failure",
          "level": "h3",
          "title": "建單失敗時的處理與重試規則"
        },
        {
          "id": "property_manager/F/repair-ticket-urgency-judgment",
          "level": "h3",
          "title": "修繕單急迫程度的判斷來源與值域"
        },
        {
          "id": "property_manager/G/meter-item-followup-scope",
          "level": "h3",
          "title": "電錶項目追問可答範圍（導向電表排障面向）"
        }
      ],
      "headings_removed": [
        {
          "id": "property_manager/A/repair-ticket-after-submit",
          "level": "h3",
          "title": "確認送出後的單如何處理"
        },
        {
          "id": "property_manager/A/repair-ticket-agent-identity-lease-lookup",
          "level": "h3",
          "title": "業務代開修繕單時的租約查詢身分規則"
        },
        {
          "id": "property_manager/A/repair-ticket-low-confidence-candidates",
          "level": "h3",
          "title": "照片辨識信心不足時的候選類別流程"
        },
        {
          "id": "property_manager/A/repair-ticket-mid-flow-cancel",
          "level": "h3",
          "title": "報修流程中途取消的規則"
        },
        {
          "id": "property_manager/A/repair-ticket-photo-count-limit",
          "level": "h3",
          "title": "修繕辨識與附件的照片張數限制"
        },
        {
          "id": "property_manager/A/repair-ticket-photo-flow",
          "level": "h3",
          "title": "開修繕單基本流程與確認機制（拍照進場／文字口述）"
        },
        {
          "id": "property_manager/A/repair-ticket-reclassify",
          "level": "h3",
          "title": "分類辨識結果錯誤時如何修改"
        },
        {
          "id": "property_manager/A/repair-ticket-submit-failure",
          "level": "h3",
          "title": "建單失敗時的處理與重試規則"
        },
        {
          "id": "property_manager/A/repair-ticket-unrecognizable-photo",
          "level": "h3",
          "title": "照片看不出損壞時的留白規則"
        },
        {
          "id": "property_manager/A/repair-ticket-urgency-judgment",
          "level": "h3",
          "title": "修繕單急迫程度的判斷來源"
        },
        {
          "id": "property_manager/A/repair-ticket-vacant-no-lease",
          "level": "h3",
          "title": "空屋或無租約物件的開單規則"
        },
        {
          "id": "property_manager/B/dunning-draft-generation",
          "level": "h3",
          "title": "催繳草稿的生成規則（模板＋語氣分級）"
        },
        {
          "id": "property_manager/B/dunning-draft-late-fee-mention",
          "level": "h3",
          "title": "催繳草稿是否提及滯納金的規則"
        },
        {
          "id": "property_manager/B/dunning-draft-not-auto-send",
          "level": "h3",
          "title": "催繳草稿不可一鍵發送給租客"
        },
        {
          "id": "property_manager/C/followup-missing-data-in-jgb",
          "level": "h3",
          "title": "追問遇到 JGB 沒有的資料時怎麼回"
        },
        {